Job Title,Location,Minimum Salary,Maximum Salary,Technologies,Company,Seniority Level
Python Developer (with Wowza experience),Zdalnie,21840,25200,"Backend, Python, AWS, Node.js",7N,Mid
"Senior Python Engineer, (monolith decomposition/domain ownership)",Zdalnie,27000,30000,"Backend, Python, Django, RabbitMQ",PandaDoc,Senior
Senior Python Developer (Digital Healthcare),Zdalnie,10643,21286,"Backend, Python, Security, FastAPI",RemoteBranch.io,Senior
Senior Python Developer,Kraków,20000,25000,"Backend, Python, pandas, NumPy",HSBC Technology Poland,Senior
Python Developer (AI/genAI),Zdalnie,18000,22000,"Backend, Python, FastAPI, NoSQL",Deviniti,Mid
Senior Backend / Python Cloud engineer,Poznań,23520,30240,"Backend, Python, REST API, FastAPI",Tangent,Senior
Back-End Software Engineer - Python / AI / ML,Zdalnie,30000,50000,"Backend, Python, SQL, Django",Knowde Inc.,Senior
Tech Lead (Python / Node),Bielsko-Biała,19000,21840,"Backend, Python, SQL, Miro",SoftKraft,Senior
Senior/Lead Python Backend Developer,Wrocław,18480,29400,"Backend, Python, Azure, angielski",Spyrosoft,Expert
Senior/Expert Python Developer,Zdalnie,26880,36960,"Backend, Python, FastAPI, Django",First Derivative,Senior
Python Developer,Wrocław,16000,18000,"Backend, Python, Django, SQL",VikingCo Poland Sp. z o.o.,Mid
Mid Python Fullstack Developer,Katowice,7000,10000,"Fullstack, Python, JavaScript, JQuery",COIG S.A.,Mid
Junior Python Developer,Zielona Góra,7900,14000,"Backend, Python, Django, SQL",B2C2 Ltd.,Junior
Backend Developer  NOWA,Zdalnie,23520,28560,"Backend, Python, Django, FastAPI",Lingaro,Senior
Software Engineer  NOWA,Zdalnie,34441,51662,"Backend, Python, IaC, Docker",Fathom Inc.,Senior
Generative AI Backend Developer (Azure),Zdalnie,27000,34500,"Backend, Python, C#, REST API",hubQuest,Mid
Senior Backend Engineer,Zdalnie,35000,54000,"Backend, Python, AWS, AI",DualEntry,Senior
Core Backend Developer,Zdalnie,20000,26000,"Backend, Python, REST API, MongoDB",plantecs,Mid
Lead FullStack Developer,Zdalnie,21400,32100,"Fullstack, Python, AWS, JavaScript",Montrose Software (Polska) Sp. z o.o.,Expert
Senior Backend Engineer,Zdalnie,39293,47835,"Backend, Python, Docker, Flask",Focal Systems,Senior
Lead Software Engineering,Warszawa,29400,34650,"Backend, Python, Scrum, Agile",smartpatient,Expert
Fullstack Developer,Zdalnie,28608,34330,"Fullstack, Python, TypeScript, AWS",Ework Group,Senior
Senior Software Engineer,Warszawa,18000,25000,"Backend, Python, Linux, Git",CloudFerro S.A,Senior
Junior Developer,Kraków,9000,11500,"Fullstack, Python, Web development, Ruby",u2i,Junior
Remote Senior Software Developer,Zdalnie,25000,28000,"Backend, Python, AWS, SQL",foodflov,Senior
AI/Full-Stack Developer,Zdalnie,34176,53400,"Backend, Python, angielski",Kenja K.K.,Senior
QA Automation Engineer with Python  NOWA,Zdalnie,12750,20000,"Testing, Python, CI/CD tools, Virtualization",CodiLime,Mid
Senior Firewall Engineer with Python  NOWA,Zdalnie,18000,29000,"Security, Python, Check Points firewalls, Network Security",CodiLime,Senior
Python Test Developer with DevOps  NOWA,Warszawa,25200,25200,"Testing, Python, Selenium, Postman",Sii Polska,Senior
Data Scientist (Python + GenAI)  NOWA,Zdalnie,24360,26880,"Data, Python, LLMs, pandas",emagine Sp. Z o.o.,Mid
"Senior Data Engineer (Python, SQL, AWS)  NOWA",Warszawa,25200,30240,"Data, Python, pandas, PySpark",Scalo,Senior
"Data Engineer (Python, AWS) - Remote  NOWA",Zdalnie,20160,23520,"Data, Python, dbt, SQL",Scalo,Mid
Senior Python Engineer (Computer Vision Team)  NOWA,Kraków,26000,36000,"Architecture, Python, Docker, Azure",Tesco Technology,Senior
Senior Firewall Engineer with Check Point and Python,Zdalnie,18000,29000,"Security, Python, Check Points firewalls, Network Security",CodiLime,Senior
Mid/Senior Network Engineer with Python - Remote,Zdalnie,16500,25000,"Testing, Python, Test automation, pytest",CodiLime,Mid
Automation Tester/QA (Python),Warszawa,15120,18480,"Testing, Python, Selenium, pytest",Scalo,Mid
Test Automation Engineer with Python,Kraków,10000,16000,"Testing, Python, CI/CD, C++",Motorola Solutions Systems Polska,Mid
Python Test Automation Engineer,Gdańsk,26880,26880,"Testing, Python, Confluence, SDLC",emagine Sp. Z o.o.,Senior
Python/Scala Developer - Remote,Zdalnie,16800,20160,"Data, Python, Scala, Spark",Link Group,Mid
Automation Tech Lead (Python),Zdalnie,28701,30751,"Testing, Python, Playwright, TypeScript",Adaptiq,Senior
Senior Automation Tester (Python),Gdynia,20160,24360,"Testing, Python, Git, BDD",Scalo,Senior
Tech Lead for Python Test Automation Developers,Warszawa,20000,29000,"Testing, Python, Team management, SQL",CloudFerro,Senior
Lider Zespołu Data Science – Python i Machine Learning,Warszawa,23000,28000,"Data, Python, Machine learning, scikit-learn",Respect Energy Holding S.A.,Senior
QA Automation Team Leader with Python Expertise,Zdalnie,26651,31981,"Testing, Python, Degree, API",Mend.io,Expert
Senior Power BI Engineer with Python skills,Zdalnie,20000,23000,"Business Intelligence, Python, Power BI, DAX",N-iX,Senior
Python Software Engineer for Big Data,Warszawa,18480,25200,"Data, Python, Spark, Databricks",AXA IT Solutions,Mid
Senior Python Developer,Zdalnie,23414,30128,"Data, Python, SQL, REST API",Plot.ai,Senior
Senior AI Engineer  NOWA,Zdalnie,28608,29502,"AI/ML, Python, Azure, FastAPI",SNI,Senior
Senior DevOps Engineer   NOWA,Katowice,16000,25000,"DevOps, Python, CI/CD, Jenkins",Jamf,Senior
Senior Test Automation Engineer  NOWA,Gdańsk,27720,27720,"Testing, Python, QA, Test automation",emagine Sp. Z o.o.,Senior
Senior Automation and Test Engineer  NOWA,Krakow,27300,32550,"DevOps, Python, Jenkins, Ansible",Mindbox S.A.,Senior
Senior Data Engineer  NOWA,Zdalnie,34000,40000,"Data, Python, SQL, dbt",Sunscrapers,Senior
Senior AI Engineer  NOWA,Zdalnie,26880,31920,"AI/ML, Python, AWS, Azure",Idego Group Sp. z o.o.,Senior
Senior Machine Learning Engineer  NOWA,Zdalnie,32088,37800,"AI/ML, Python, SQL, TensorFlow",OpenX,Senior
Senior Network Automation Test Engineer  NOWA,Zdalnie,23100,31500,"Testing, Python, Robot Framework, Networking",Amartus Polska Sp. z o.o.,Senior
Software QA Engineer with Networking - Remote  NOWA,Zdalnie,13000,23000,"Testing, Python, CI/CD tools, Jenkins",CodiLime,Mid
Data Scientist (BioPharma)  NOWA,Zdalnie,18480,22680,"Data, Python, Machine learning, NLP",Holisticon Connect,Mid
Data Scientist - Remote   NOWA,Zdalnie,17000,25000,"Data, Python, angielski",Link Group,Mid
Gen AI Platform Architect  NOWA,Zdalnie,26600,36650,"AI/ML, Python, AWS, Gen AI",Xebia sp. z o.o.,Expert
Data Scientist - 100% remote  NOWA,Zdalnie,21840,25200,"Data, Python, NLP, AWS",AVENGA,Mid
Senior Data Engineer -100% remote  NOWA,Zdalnie,28560,31920,"Data, Python, angielski, polski",AVENGA,Senior
Senior Data Engineer  NOWA,Zdalnie,24000,30000,"Data, Python, Big data, Data engineering",Grape Up,Senior
Senior Data Scientist Remote  NOWA,Zdalnie,20160,26880,"Data, Python, Data analysis, Machine learning",DS STREAM,Senior
Remote Data Engineer   NOWA,Zdalnie,15000,19000,"Data, Python, Data modelling, Storage",Kingfisher plc.,Mid
Senior Data Project Manager  NOWA,Zdalnie,16400,24601,"Data, Python, Data engineering, AWS",N-iX,Senior
Machine Learning Engineer  NOWA,Zdalnie,13500,21600,"AI/ML, Python, Machine learning, Data science",Boneffice System,Mid
Senior Bioinformatics Data Engineer - cBioPortal  NOWA,Zdalnie,23520,26880,"Data, Python, SQL, pandas",Holisticon Connect,Senior
Middle/Senior Data Engineer for Technology Office   NOWA,Zdalnie,20501,24601,"Data, Python, Databricks, dbt",N-iX,Senior
DevOps Engineer,Zdalnie,24601,28701,"DevOps, Python, Linux, Python/Go/Bash",Gett,Senior
Senior Cloud Data Engineer,Warszawa,25000,34000,"DevOps, Python, Data modeling, Data pipelines",Link Group,Senior
Senior Data Engineer,Zdalnie,18450,24601,"Data, Python, Azure, MySQL",N-iX,Senior
Senior Data Engineer,Zdalnie,18000,25000,"Data, Python, SQL, T-SQL",XTB,Senior
Data Architect,Zdalnie,28560,31080,"Data, Python, Databricks, Azure Data Factory",AVENGA,Mid
BI/Data Engineer for Data Warehouse,Zdalnie,12771,23414,"Data, Python, BI, DWH",Manpower Group,Mid
"Staff Software Engineer, AI Inference",Zdalnie,20501,41002,"AI/ML, Python, Public cloud, GCP",Speechify,Senior
Data Analyst,Kraków,30240,33600,"Data, Python, Azure Databricks, TDD",Mindbox S.A.,Mid
Lead Data Scientist / ML Engineer,Zdalnie,19320,28560,"AI/ML, Python, Machine learning, Data science",Addepto,Senior
Data Scientist / ML Engineer,Zdalnie,16800,28560,"AI/ML, Python, Machine learning, Data science",Addepto,Senior
Data Engineer,Wrocław,23520,26880,"Data, Python, Azure Data Factory, Azure Databricks",AVENGA,Mid
"Software Engineering Manager (AI, Knowledge Platform)",Zdalnie,30000,35000,"AI/ML, Python, People Management, SDLC",Infermedica Sp z.o.o,Senior
Data Scientist - Computer Vision,Kraków,20000,27000,"Data, Python, Testing, Docker",Tesco Technology,Mid
Bioinformatyk,Zdalnie,19320,23520,"Data, Python, R, Bash",AVENGA,Senior
Senior Test Automation Engineer (Python+Robot Framework),Warsaw,26880,26880,"Testing, Python, Git, Robot Framework",emagine Sp. Z o.o.,Senior
Remote Embedded Test Automation Engineer,Zdalnie,23520,30000,"Testing, Python, Communication skills, Git",int2code GmbH,Mid
Microsoft Azure DevOps Cloud Engineer (Azure WAF Engineer),Krakow,23100,27300,"DevOps, Python, Azure, IaaS",Mindbox S.A.,Senior
Databricks Expert/ Consultant,Zdalnie,25000,35000,"Data, Python, Databricks, Spark",Xebia sp. z o.o.,Expert
Senior MLOps Engineer,Kraków,30240,35280,"DevOps, Python, GCP, BigQuery",j-labs software specialist,Senior
Tester Automatyzujący,Warszawa,10080,15120,"Testing, Python, Test automation, Selenium",Goldenore  ITC Sp. z o.o.,Mid
Senior Data Engineer,Zdalnie,25500,33000,"Data, Python, DWH, Data pipelines",Proxet,Senior
Senior Machine Learning Engineer,Zdalnie,22000,28000,"AI/ML, Python, Machine learning, Communication skills",Tooploox,Senior
Software DevOps Engineer,Łódź,20000,30000,"DevOps, Python, Docker, C++",HEXAGON | Intergraph Polska Sp. z o.o.,Senior
Data Platform Engineer,Warszawa,20000,30000,"Data, Python, DevOps, Oracle DB",Schenker Technology Center (Warsaw) sp. z o.o.,Mid
PySpark Developer,Zdalnie,18480,21840,"Data, Python, Data engineering, Big data",Link Group,Senior
Data Scientist,Zdalnie,24000,30000,"Data, Python, NLP, AWS",Sii Polska,Senior
CI/CD Engineer,Warsaw,28560,28560,"DevOps, Python, SonarQube, Maven",emagine Sp. Z o.o.,Mid
ML/AI Engineer,Zdalnie,25200,33600,"AI/ML, Python, AI, Databricks",Lingaro,Expert
Data Engineer - Tech Lead (Ukrainian speaking),Zdalnie,28701,34851,"Data, Python, SQL, Databricks",Alcor,Expert
Application Security Engineer,Zdalnie,27720,33600,"Security, Python, BlackDuck, Nexus IQ",Avenga,Senior
Senior Data Engineer,Gdynia,25200,30240,"Data, Python, Spark, Big data",emagine Sp. Z o.o.,Senior
Senior Generative AI Data Scientist,Warszawa,14280,28560,"AI/ML, Python, AI, Data science",Spyrosoft,Senior
Mid AI/ML Engineer - 100% Remote,Zdalnie,10000,15000,"AI/ML, Python, TensorFlow, Machine learning",Camino Science sp. z o.o.,Mid
ML engineer / Data Scientist,Zdalnie,20160,21840,"Data, Python, MLOps, UI",ITFS Sp. z o.o.,Mid
Remote Junior/Mid Cloud Infrastructure Specialist / Infrastructure Operations Specialist,Zdalnie,10250,20501,"DevOps, Python, Bash, UNIX/Linux",Talentica,Mid
Senior Cloud DevOps Engineer,Kraków,15000,21000,"DevOps, Python, Cloud, Cloud platform",Motorola Solutions Systems Polska,Senior
Site Reliability Engineer Senior,Zdalnie,19000,20000,"DevOps, Python, Linux, Python/Golang",Akamai,Senior
Senior Site Reliability Engineer,Zdalnie,19000,20000,"DevOps, Python, Linux, Python/Golang",Akamai,Senior
Site Reliability Engineer (Mid),Zdalnie,13000,14000,"DevOps, Python, Linux, Python/Golang",Akamai,Mid
Data Scientist,Zdalnie,16000,18000,"Data, Python, SQL, AWS",Commerce Media Tech,Senior
Senior AI / GenAI Engineer,Zdalnie,25831,36901,"AI/ML, Python, Azure, ML",N-iX,Senior
Senior Test Automation Engineer,Gdańsk,27720,27720,"Testing, Python, SQL, ETL",emagine Sp. Z o.o.,Senior
Engineering Manager (AI & Big Data),Zdalnie,24000,30000,"AI/ML, Python, Team management, Technical background",Addepto,Senior
Middle/Senior Data Engineer,Zdalnie,16400,21526,"Data, Python, SQL, AWS",N-iX,Mid
Senior DevOps Engineer,Zdalnie,32000,42000,"DevOps, Python, GCP, K8s",RTB House,Senior
DevOps Engineer,Warszawa,25000,30000,"DevOps, Python, Azure, Azure Cloud",Respect Energy Fuels,Mid
Junior DevOps Engineer,Zdalnie,7000,12000,"DevOps, Python, Terraform, K8s",SlickCloud,Junior
Project Manager (AI & Big Data)  NOWA,Zdalnie,18000,26000,"AI/ML, Python, Project management, Team management",Addepto,Senior
Power Engineer with basic Python  NOWA,Zdalnie,7200,14400,"Data, Python, Data science, Power Engieering",Boneffice System,Mid
Senior Fullstack Developer (React + Python)  NOWA,Gdańsk,22680,27216,"Fullstack, Python, React, Material UI",Bright Inventions,Senior
AWS Fullstack Developer React + Python,Zdalnie,16400,20501,"Fullstack, Python, React, AWS",Excedo Services sp. z o.o.,Mid
"Financial Data Engineer (Python, SQL)",Zdalnie,15120,19320,"Data, Python, SQL, Git",SoftKraft,Mid
Senior Java/Python Developer,Zdalnie,16800,23520,"Backend, Python, Java, Degree",Sopra Steria Poland,Senior
DevOps Engineer  NOWA,Zdalnie,21000,33600,"DevOps, Python, AWS, Terraform",Cognitran,Senior
.NET Core Cloud Engineer (CommandCental Drive)  NOWA,Kraków,15000,18000,"Backend, Python, .NET, Cloud",Motorola Solutions Systems Polska,Senior
Security Architect  NOWA,Kraków,28560,33600,"Architecture, Python, C, C++",Devire,Senior
Middle/Senior C++ Software Engineer  NOWA,Zdalnie,16000,21000,"Backend, Python, C++, Build tools like CMake",SoftServe,Mid
Data Engineer  NOWA,Zdalnie,28000,32000,"Data, Python, Azure, Data pipelines",AVENGA,Senior
Expert/Senior DevOps Engineer - Cross Platform Team  NOWA,Warszawa,12000,22000,"DevOps, Python, RedHat, CoreOS",ING BANK ŚLĄSKI SPÓŁKA AKCYJNA,Senior
GCP Platform Engineer  NOWA,Zdalnie,15120,17472,"DevOps, Python, GCP, Terraform",ITFS Sp. z o.o.,Mid
Inżynier DevOps  NOWA,Zdalnie,25200,25200,"DevOps, Python, Ansible, Terraform",emagine Sp. Z o.o.,Mid
Software Engineer with C and Linux Device Drivers  NOWA,Zdalnie,13000,23000,"Embedded, Python, C, PyATS",CodiLime,Mid
Delphi Developer  NOWA,Zdalnie,21000,21000,"Backend, Python, Delphi, CI/CD",Sii Polska,Senior
Senior Data Scientist  NOWA,Zdalnie,27714,28608,"Data, Python, AWS, MLOps",SNI,Senior
Business Analyst (IT and Regulatory Reporting)  NOWA,Warszawa,27000,30000,"Business Analysis, Python, Business analysis, Project management",Antal,Senior
Cyber Security Analyst - Remote  NOWA,Zdalnie,16800,21840,"Security, Python, SQL, Splunk",Link Group,Mid
AWS Cloud Architect  NOWA,Zdalnie,27000,35000,"Architecture, Python, AWS, AWS Cloud",Idego Group Sp. z o.o.,Senior
System Administrator (Windows)  NOWA,Zdalnie,15120,18480,"Sys. Administrator, Python, Microsoft Windows, HA",Scalo,Senior
Senior QA Engineer - Remote   NOWA,Zdalnie,20160,23520,"Testing, Python, Java, QA",Infogain Technologies Sp. z o.o.,Senior
Senior Data Engineer z j. angielskim lub niemieckim (People and Project Analytics)  NOWA,Zdalnie,18480,25200,"Data, Python, SQL, Java",dmTECH,Senior
Senior Full-Stack/Back-end Developer C++  NOWA,Kraków,18000,23000,"Fullstack, Python, C++, JavaScript",Motorola Solutions Systems Polska,Senior
Senior Network Automation Software Engineer  NOWA,Zdalnie,25200,33600,"Telekomunikacja, Python, CISCO NSO, Networking",Amartus Polska Sp. z o.o.,Senior
Senior Security Engineer  NOWA,Zdalnie,26880,28560,"Security, Python, OWASP, SonarQube",Scalo,Senior
Data Engineer – Cloud Data Solutions  NOWA,Kraków,21000,29000,"Data, Python, Spark, Azure Cloud",ITDS,Senior
Kierownik Zespołu/Full Stack Developer z C++  NOWA,warszawa,30000,36000,"Fullstack, Python, C++, REST",WB ELectronics S.A.,Expert
Middle Data Scientist Generative AI  NOWA,Zdalnie,15000,20000,"Data, Python, LLM, NLP",SoftServe,Mid
Senior Security Engineer  NOWA,Warszawa,29000,47000,"Security, Python, AWS, Bash",hyperexponential,Senior
Senior Technical Support Engineer ( L3 )  NOWA,Zdalnie,11152,13284,"Support, Python, Java, JavaScript",Mend.io,Senior
Weblogic Administrator Engineer  NOWA,Zdalnie,7000,12000,"Sys. Administrator, Python, WebLogic, Security",Sopra Steria Poland,Mid
Data Architect  NOWA,Wrocław,31920,36960,"Data, Python, Azure, AI",Experis Polska,Mid
Software Backend Developer  NOWA,Warszawa,13000,17000,"Backend, Python, C, Perl",Link Group,Mid
Test Automation Lead - Remote  NOWA,Zdalnie,16800,16800,"Testing, Python, Test automation, CI/CD",Link Group,Senior
Senior Azure MLOps Engineer  NOWA,Zdalnie,30000,37000,"DevOps, Python, Azure, TFS",hubQuest,Senior
Senior Data Scientist  NOWA,Warszawa,22400,33600,"Data, Python, Machine learning, Analytical skills",Adform Sp. z o.o.,Senior
Devops Engineer  NOWA,Gdańsk,21840,22680,"DevOps, Python, Java, SQL",AVENGA,Mid
Remote Embedded C/C++ Developer  NOWA,Zdalnie,20160,33600,"Embedded, Python, C, Linux",int2code GmbH,Mid
Data Engineer (GCP)  NOWA,Zdalnie,18480,26880,"Data, Python, GCP, SQL",GetInData | Part of Xebia,Mid
Specjalista DevOps   NOWA,Zdalnie,16800,23520,"DevOps, Python, Linux, RHEL",Ness Solution,Mid
Data Engineer Lead  NOWA,Zdalnie,28560,31920,"Data, Python, SQL, Google BigQuery",KAHOOT! POLAND SPÓŁKA Z OGRANICZONĄ ODPOWIEDZIALNOŚCIĄ,Mid
Senior Data Engineer – Europe Ambulance initiative  NOWA,Warsaw,21000,26000,"Data, Python, PySpark, Azure",Falck Digital Technology Poland Sp. z o.o.,Senior
Scala Developer  NOWA,Gdańsk,25200,28560,"Data, Python, Scala, Spark",emagine Sp. Z o.o.,Mid
Senior Perception Robotics Engineer  NOWA,Zdalnie,18000,28000,"Automatyka, Python, C++, TensorFlow",SoftServe,Senior
Senior Robotics Engineer  NOWA,Zdalnie,18000,28000,"Automatyka, Python, C++, ROS",SoftServe,Senior
Data Engineering Tech Lead (Databricks)  NOWA,Zdalnie,24109,30997,"Data, Python, Snowflake, Relational database",N-iX,Expert
Senior Data Scientist  NOWA,Zdalnie,17500,22500,"Data, Python, Deep learning, Data science",Boneffice System,Senior
Senior QA Engineer  NOWA,Zdalnie,16500,22000,"Testing, Python, Playwright, Selenium",Grape Up,Senior
Senior/Regular C++ Developer – Automotive  NOWA,Zdalnie,11760,22680,"Embedded, Python, C++, Git",Spyrosoft,Senior
Senior Software Engineer  NOWA,Zdalnie,28560,38640,"Data, Python, ETL, SQL",Devire,Senior
LLM Developer  NOWA,Białystok,24000,32000,"AI/ML, Python, LLM, RAG",Sii Polska,Senior
Platform Engineer  NOWA,Kraków,11700,19600,"Fullstack, Python, Java, AWS",Ringier Axel Springer Tech,Mid
Data Scientist  NOWA,Zdalnie,15000,19000,"Data, Python, SQL, LlamaIndex",XTB,Mid
Cloud Engineer,Zdalnie,15340,18170,"DevOps, Python, Cloud, Security",Bamboo Health Sp. z o.o.,Mid
Product Security Architect,Kraków,17000,26000,"Security, Python, Degree, CISSP",Motorola Solutions Systems Polska,Senior
Data Engineer Lead,Zdalnie,22000,27500,"Data, Python, Scala, GCP",Harvey Nash Technology,Senior
Senior Distributed Systems Engineer,Zdalnie,35000,47000,"Backend, Python, Java, Jenkins",RTB House,Senior
Senior Data Engineer,Zdalnie,21321,25421,"Data, Python, AWS, Glue",N-iX,Senior
Lead Data Engineer,Zdalnie,25421,27881,"Data, Python, AWS, SQL",N-iX,Expert
Senior Data Engineer (Azure),Zdalnie,26880,28560,"Data, Python, Azure, Data engineering",Scalo,Senior
Financial Engineering Business Analyst,Cracow,26880,26880,"Business Analysis, Python, Degree, Business Analyst",emagine Sp. Z o.o.,Senior
Senior Data Science Engineer,Zdalnie,26040,31920,"Data, Python, Machine learning, Analytical skills",Infogain Technologies Sp. z o.o.,Senior
Lead Platform/DevOps Engineer,Zdalnie,28701,32801,"DevOps, Python, Ansible, Integration test",TechHunt,Expert
Senior Business Analyst – Financial Risk Management,Warsaw,28560,36960,"Business Analysis, Python, Business Analyst, Testing",Link Group,Senior
DevOps Engineer,Warszawa,25200,25200,"Sys. Administrator, Python, RHEL, Bash script",P&P Solutions Sp. z o.o.,Mid
Administrator Systemów Linux,Kraków,10000,15000,"Sys. Administrator, Python, Linux, RHEL",Unity-T Group,Mid
Site Reliability Engineer,Zdalnie,21000,27000,"DevOps, Python, SRE, Prometheus",XTB,Senior
Data Analyst,Zdalnie,12000,17000,"Data, Python, SQL, Azure",XTB,Mid
FULLSTACK C++ DEVELOPER (PROGRAMISTA C++),Mielec,10000,15000,"Fullstack, Python, C++, Qt",R&G Plus,Mid
Senior Azure DevOps Engineer,Zdalnie,30000,37000,"DevOps, Python, Azure, Azure Cloud",hubQuest,Senior
"Senior Software Engineer, Data Infrastructure",Warszawa,29000,36800,"DevOps, Python, AWS, SQL",Asana,Senior
Cloud Engineer (preferably AWS),Gdańsk,33600,33600,"DevOps, Python, AWS, Terraform",emagine Sp. Z o.o.,Mid
Senior DevOps Engineer,Zdalnie,24601,28701,"DevOps, Python, AWS, Terraform",Naviteq,Senior
Remote Senior Fullstack Developer,Zdalnie,20000,24000,"Fullstack, Python, Golang, GraphQL","Tempest Labs, Inc.",Senior
Azure Data Engineer - Remote,Zdalnie,24601,30751,"Data, Python, Azure, Azure Data Factory",Link Group,Senior
Administrator Systemów / DevOps,Gdańsk,7500,15000,"Sys. Administrator, Python, Linux, Nginx",Parleto,Mid
Backend Developer (project-based) - Remote,Zdalnie,20501,24601,"Backend, Python, Web3, Node.js",Linum Labs,Mid
Quality Automation Engineer,Zdalnie,16400,22551,"Testing, Python, .NET, Test automation",PAR Data Central,Senior
Cyber Threat Intelligence Analyst,Zdalnie,17800,30000,"Security, Python, DevSecOps, Cybersecurity",Volvo Group,Senior
DevOps,Gdańsk,10000,15000,"DevOps, Python, K8s, Ansible",Centrum Usług Informatycznych Politechnika Gdańska,Mid
DevOps Engineer (Sportsbetting),Zabierzów,14000,28000,"DevOps, Python, Terraform, AWS",NOVOMATIC Technologies Poland,Senior
Cyber Threat Intelligence Analyst,Kraków,11000,17000,"Security, Python, Threat and vulnerability assessments, OSINT",Motorola Solutions Systems Polska,Mid
IT Architect/Product Owner,Zdalnie,31080,31080,"Product Management, Python, Keycloak, Security",Unravel,Senior
Mid/Senior Test Automation Engineer with Traffic Generators - Remote,Zdalnie,16500,23000,"Testing, Python, Test automation, IXIA",CodiLime,Mid
Mid/Senior Data Engineer,Zdalnie,23520,31080,"Data, Python, Hadoop, Scala",GetInData | Part of Xebia,Senior
Software Development Engineer - Messaging Platform,Kraków,20000,24000,"PM, Python, Degree, Golang",Remitly Poland sp. z o.o.,Mid
Senior C Software Engineer,Kraków,15000,21000,"Embedded, Python, C, C++",Motorola Solutions Systems Polska,Senior
Senior BI Tableau Specialist,Zdalnie,23520,27720,"Business Intelligence, Python, Tableau, Talend",AVENGA,Senior
TIBCO Integration Developer,Zdalnie,27720,31080,"Inne, Python, TIBCO, Java",1dea,Senior
Senior DevOps and Cloud Infrastructure Engineer,Zdalnie,18509,24679,"DevOps, Python, AWS, K8s",IDBC Creative Solutions Kft.,Expert
Programista PHP,Gdynia,7000,13000,"Fullstack, Python, PHP, SQL",ENAMOR SPÓŁKA Z OGRANICZONĄ ODPOWIEDZIALNOŚCIĄ,Mid
Ekspert IT w zakresie rozwiązań sieciowych,Gliwice,15000,21000,"Sys. Administrator, Python, BGP, OSPF",WASKO S.A.,Senior
Senior Fullstack Developer,Warszawa,22000,27000,"Fullstack, Python, Java, AWS",PYSENSE Sp. z o. o.,Senior
Programista Linux (C/C++),Warszawa,17000,23000,"Backend, Python, C++, C",Superdevs,Senior
CI/CD Engineer,Zdalnie,15000,22000,"Inne, Python, CI/CD, Linux",XTB,Mid
Remote Lead Fullstack Developer,Zdalnie,25000,35000,"Fullstack, Python, JavaScript, React",Flyps,Senior
Software Engineer,Kraków,22000,22000,"Fullstack, Python, .NET, Cloud",Medius,Mid
Senior Data Engineer,Kraków,20000,20000,"Data, Python, Databricks, ETL",Medius,Senior
Machine Learning Engineer (100% remote),Zdalnie,16800,25200,"AI/ML, Python, Machine learning, Big data",Devire,Mid
Senior AI Engineer,Zdalnie,26880,31920,"AI/ML, Python, GPT4 API, Claude",Devire,Senior
Senior Embedded Developer,Warszawa,17000,22000,"Embedded, Python, C++, C",PYSENSE Sp. z o. o.,Senior
Lead DevOps AWS Engineer,Zdalnie,30751,32801,"DevOps, Python, AWS, Kubernates",Appex Team,Senior
AWS Backend Developer,Zdalnie,24109,34441,"Backend, Python, Node.js, AWS",Unisystech Consulting Inc.,Senior
DevOps Engineer,Zdalnie,7000,12000,"DevOps, Python, JavaScript, PHP",Sopra Steria Poland,Mid
Senior DevOps Engineer,Zdalnie,25000,32000,"DevOps, Python, AWS, K8s",Zowie,Senior
CloudOps Software Engineer,Kraków,15000,19000,"DevOps, Python, Azure, AWS",Motorola Solutions Systems Polska,Senior
Embedded Software Engineer with C++,Kraków,12000,18000,"Embedded, Python, C++, OpenCV",Motorola Solutions Systems Polska,Senior
"Full-Stack / Front-End Developer (TypeScript, JavaScript, Node.js)",Kraków,9000,16000,"Fullstack, Python, Angular, JavaScript",Motorola Solutions Systems Polska,Mid
DevOps/SCM Engineer,Kraków,12000,19000,"DevOps, Python, Jenkins, Atlassian",Motorola Solutions Systems Polska,Senior
Senior Full-Stack/Back-end Developer C++,Kraków,18000,23000,"Fullstack, Python, C++, JavaScript",Motorola Solutions Systems Polska,Senior
Performance Tester,Zdalnie,16800,23100,"Testing, Python, JMeter, Locust",Sii Polska,Senior
Fullstack Developer (Java/Angular),Zdalnie,20160,26880,"Fullstack, Python, Angular, Team work",Knowit,Mid
DevOps Engineer (Canada PST),Zdalnie,22680,28560,"DevOps, Python, Ansible, AWS",AVENGA,Senior
Senior Embedded Engineer,Wrocław,18480,24360,"Embedded, Python, C++, Embedded system",Clone Incorporated,Senior
Medior/Senior Mendix Low-Code fejlesztő,Zdalnie,8740,10283,"Fullstack, Python, Mendix, Angular",Stylers Kft.,Mid
Senior Product Analyst,Zdalnie,20501,24601,"Data, Python, SQL, Communication skills",N-iX,Senior
Full-Stack Developer,Warsaw,12000,17000,"Fullstack, Python, JavaScript, Web applications",Engager.app,Mid
Security Engineer,Kraków,14000,23000,"Security, Python, Enterprise Security, SIEM",Motorola Solutions Systems Polska,Mid
